{
  "schema_version": 1,
  "work_unit_id": "11111111-1111-4111-8111-111111111111",
  "project_id": "sample-project",
  "kind": "implementation",
  "purpose": "feature",
  "consumption_reason": "primary",
  "profile": "codex",
  "model": "unknown",
  "tokens": {
    "input": null,
    "output": null,
    "total": null
  },
  "token_source": "unavailable",
  "elapsed_ms": 120000,
  "outcome": "completed",
  "retry_count": 0,
  "review_findings_count": 1,
  "rework_count": 0,
  "quality_gate": "pass",
  "links": {
    "issue_number": 34,
    "release": "v0.2.4"
  },
  "artifact_refs": [
    {
      "type": "path",
      "value": "docs/framework/effect-metrics.md"
    }
  ],
  "collector_id": "workstation-a",
  "recorded_at": "2026-08-12T12:00:00+09:00"
}
