{
  "schema_version": 1,
  "work_unit_id": "11111111-1111-4111-8111-111111111111",
  "project_id": "sample-project",
  "kind": "implementation",
  "purpose": "feature",
  "consumption_reason": "primary",
  "profile": "codex",
  "model": "unknown",
  "tokens": { "input": 10, "output": 5, "total": 15 },
  "token_source": "manual",
  "elapsed_ms": 120000,
  "outcome": "completed",
  "retry_count": 0,
  "review_findings_count": 1,
  "rework_count": 0,
  "quality_gate": "pass",
  "links": { "issue_number": 34, "pr_number": 60, "release": "v0.2.4" },
  "artifact_refs": [{ "type": "issue", "number": 34 }, { "type": "pr", "number": 60 }],
  "collector_id": "fixture-a",
  "recorded_at": "2026-08-10T10:00:00Z"
}
